product_id,product_code,product_type,item_name,color,Currency,Value
3.0744573456180675e+18,1B0VA0F01CF0NO,Valentino Pink PP Collection,CREPE COUTURE MIDI DRESS WITH BOW DETAILS,black,CAD,7430.00
3.0744573456180675e+18,1B0VA0G51CF0NO,Valentino Pink PP Collection,CREPE COUTURE SHORT DRESS,black,CAD,6550.00
3.074457345618038e+18,1W2S0FI1VNE0NO,Valentino Pink PP Collection,VALENTINO GARAVANI TAN-GO PATENT LEATHER PUMP 100MM,black,CAD,1450.00
3.074457345618038e+18,1W0T0SB7JXJ0NO,Valentino Pink PP Collection,ONE STUD SHINY CALFSKIN BELT 40MM,black,CAD,740.00
3.0744573456180675e+18,1B0VE2401CF0NO,Valentino Pink PP Collection,CREPE COUTURE JUMPSUIT,black,CAD,6930.00
3.074457345618038e+18,1W0S0FH8USI0NO,Valentino Pink PP Collection,ONE STUD PATENT LEATHER PUMP 100 MM,black,CAD,1630.00
3.0744573456180675e+18,1B0CJ2Y06PJ0NO,Valentino Pink PP Collection,DIAGONAL DOUBLE WOOL PEACOAT WITH BOW DETAILS,black,CAD,5670.00
3.0744573456180675e+18,1B0RA9401CF0NO,Valentino Pink PP Collection,CREPE COUTURE MINI SKIRT,black,CAD,2650.00
3.0744573456180675e+18,1B0VA0G61CF0NO,Valentino Pink PP Collection,CREPE COUTURE SHORT DRESS,black,CAD,4790.00
3.074457345618069e+18,1W0S0DT4USI0NO,Valentino Pink PP Collection,ONE STUD PATENT LEATHER PUMP WITH MATCHING STUD 90 MM,black,CAD,1220.00
3.074457345618069e+18,1W0S0FE2ATZ0NO,Valentino Pink PP Collection,VALENTINO GARAVANI TAN-GO PLATFORM ANKLE BOOT IN CALFSKIN 120MM,black,CAD,2000.00
3.0744573456180367e+18,1W2S0FE1ATZ0NO,Valentino Pink PP Collection,VALENTINO GARAVANI TAN-GO PLATFORM ANKLE BOOT IN CALFSKIN 155MM,black,CAD,2005.00
3.074457345618068e+18,1V0MF20I8YA0NO,Valentino Pink PP Collection,"COTTON SWEATSHIRT WITH ""WE ALL HAVE SECRET MESSAGES HIDDEN WITHIN US"" PRINT BY DOUGLAS COUPLAND",black,CAD,1580.00
3.074457345618068e+18,1V0MG10V8YD0NO,Valentino Pink PP Collection,"COTTON T-SHIRT WITH ""I MISS MY PRE-INTERNET BRAIN"" PRINT BY DOUGLAS COUPLAND",black,CAD,950.00
3.074457345618069e+18,1W0GCA19RPB0NO,Valentino Pink PP Collection,VLOGO SIGNATURE JERSEY GLOVES,black,CAD,1000.00
3.074457345618069e+18,1W0J0F85VTRN89,Valentino Pink PP Collection,VLOGO SIGNATURE METAL AND CRYSTAL EARRINGS,black,CAD,690.00
3.074457345618069e+18,1W0J0R97VTRN89,Valentino Pink PP Collection,BRIGHTRAIN METAL AND CRYSTAL EARRINGS,black,CAD,2890.00
3.074457345618069e+18,1W0J0G73VTRN89,Valentino Pink PP Collection,VLOGO SIGNATURE METAL AND CRYSTAL EARRINGS,black,CAD,820.00
3.074457345618069e+18,1W0J0F96ZLQ0NO,Valentino Pink PP Collection,VLOGO SIGNATURE METAL EARRINGS,black,CAD,620.00
3.0744573456180874e+18,2B0VA3B35A6MTH,Dresses,COTTON POPELINE SHORT DRESS,WHITE/LIGHT CAMEL,CAD,4410.00
3.074457345618073e+18,2B3VA1651CF0NI,Dresses,CREPE COUTURE SHORT DRESS,black/white,CAD,6170.00
3.074457345618074e+18,2B3VA2K57N50NA,Dresses,VALENTINO CHAIN 1967 CREPE COUTURE SHORT DRESS,white/ black,CAD,5670.00
3.074457345618074e+18,2B3VA2H57N50NA,Dresses,VALENTINO CHAIN 1967 CREPE COUTURE AND POPELINE SHORT DRESS,white/ black,CAD,5020.00
,2B0VA3801MH157,Dresses,SHORT GEORGETTE DRESS,,CAD,8190.00
3.0744573456180864e+18,2B0VA3M57SLUL0,Dresses,LONG DRESS IN TOILE ICONOGRAPHE CREPE DE CHINE,BEIGE/RED,CAD,8190.00
3.0744573456180874e+18,2B0VA3W07W4UL0,Dresses,TOILE ICONOGRAPHE SHORT POPELINE DRESS,BEIGE/RED,CAD,5670.00
3.0744573456180864e+18,2B0VE2L75DN157,Dresses,COMPACT POPELINE JUMPSUIT,red,CAD,4910.00
,2B0VA3787SLE21,Dresses,MIDI DRESS IN TOILE ICONOGRAPHE CREPE DE CHINE,,CAD,11970.00
3.074457345618073e+18,2B3VA1Y21CF0NO,Dresses,CREPE COUTURE SHORT DRESS,black,CAD,5290.00
3.0744573456180337e+18,1B3VDDU05DN001,Dresses,COMPACT POPELINE EVENING DRESS,white,CAD,5920.00
3.074457345618074e+18,2B3VA1L15A60BO,Dresses,EMBROIDERED COTTON POPELINE MIDI DRESS,white,CAD,7430.00
3.074457345618074e+18,2B3VDEQ07M9YSZ,Dresses,LONG DRESS IN COTTON GUIPURE LACE,yellow,CAD,8690.00
3.074457345618074e+18,2B3VE2G07T2V5R,Dresses,MANIFESTO BANDANA FOULARD TWILL JUMPSUIT,YELLOW/MULTICOLOR,CAD,8690.00
3.074457345618074e+18,2B3VA2G57M9YSZ,Dresses,COTTON GUIPURE LACE MIDI DRESS,yellow,CAD,6170.00
3.074457345618074e+18,2B3VA3207M9YSZ,Dresses,COTTON GUIPURE LACE CAFTAN DRESS,yellow,CAD,4910.00
3.074457345618033e+18,1B3VA0455A60BO,Dresses,COTTON POPELINE MIDI DRESS,white,CAD,4660.00
3.074457345618074e+18,2B3VAZ297SR0BO,Dresses,VALENTINO BRODERIE INFINIE WAVES SHORT DRESS,white,CAD,7430.00
3.074457345618074e+18,2B3VA3207M9YU4,Dresses,COTTON GUIPURE LACE CAFTAN DRESS,ASTRAL PURPLE,CAD,4910.00
3.074457345618073e+18,2B3KD09I7PVUK4,Dresses,CROCHET WORK VISCOSE DRESS,ECRU/BROWN/BLACK,CAD,5290.00
3.074457345618074e+18,2B3VE2F07SYM12,Dresses,VALENTINO CHAIN 1967 FOULARD TWILL JUMPSUIT,BROWN/MULTICOLOR,CAD,6930.00
3.074457345618073e+18,2B3VA1E61CFNUD,Dresses,EMBROIDERED CREPE COUTURE SHORT DRESS,NERO/ARGENTO,CAD,9450.00
3.074457345618074e+18,2B3VA2S06U9U48,Dresses,EMBROIDERED WOOL TWEED SHORT DRESS,IVORY/SILVER,CAD,6930.00
3.074457345618073e+18,2B3VA1B31CFU48,Dresses,EMBROIDERED CREPE COUTURE SHORT DRESS,IVORY/SILVER,CAD,6930.00
3.074457345618074e+18,2B3VA2C51CFNUD,Dresses,EMBROIDERED CREPE COUTURE SHORT DRESS,NERO/ARGENTO,CAD,5670.00
3.074457345618074e+18,2B3VA2K77M853P,Dresses,VALENTINO CHAIN 1967 SHORT BROCADE DRESS,WHITE/GOLD,CAD,6170.00
3.074457345618073e+18,2B3KD09M7NS0NO,Dresses,VLOGO CHAIN SHORT DRESS IN MOHAIR AND HEAVY LACE,black,CAD,4410.00
3.074457345618074e+18,2B3VA2087M6G70,Dresses,VALENTINO GOLDEN WINGS BROCADE CAFTAN DRESS,gold,CAD,5670.00
3.074457345618073e+18,2B3KC43R7RJM12,Dresses,OPTICAL VALENTINO LUREX JACQUARD SWEATER WITH FEATHERS,GOLD/MULTICOLOR,CAD,6170.00
3.074457345618074e+18,2B3VA2C01EDYU4,Dresses,TULLE ILLUSIONE EMBROIDERED DRESS,ASTRAL PURPLE,CAD,13230.00
3.074457345618074e+18,2B3VA2W01EDCJ5,Dresses,TULLE ILLUSIONE EMBROIDERED DRESS,yellow,CAD,11970.00
3.074457345618074e+18,2B3VA2057LRM12,Dresses,VALENTINO GOLDEN WINGS MULTICOLOR BROCADE CAFTAN DRESS WITH FEATHERS,multicolored,CAD,6930.00
3.074457345618074e+18,2B3VA1Y61EDG70,Dresses,TULLE ILLUSIONE EMBROIDERED SHORT DRESS,gold,CAD,22680.00
3.074457345618074e+18,2B3VA2Z03600NO,Dresses,HEAVY LACE - CREPE COUTURE SHORT DRESS,black,CAD,6550.00
,2B3VA2J01EDK92,Dresses,TULLE ILLUSIONE EMBROIDERED DRESS,,CAD,15120.00
3.074457345618074e+18,2B3VA2D07TDE21,Dresses,TOILE ICONOGRAPHE LIGHT SHORT DRESS,BEIGE/BLACK,CAD,5290.00
3.074457345618074e+18,2B3VA2477TDE21,Dresses,DRESS IN TOILE ICONOGRAPHE LIGHT,BEIGE/BLACK,CAD,6170.00
3.074457345618074e+18,2B3VA2116U80NO,Dresses,VLOGO CHAIN SHORT DRESS IN WOOL TWEED,black,CAD,5540.00
3.074457345618074e+18,2B3VAZU21CF157,Dresses,CREPE COUTURE DRESS,red,CAD,4660.00
3.074457345618074e+18,2B3VA1G47TDUL0,Dresses,TOILE ICONOGRAPHE LIGHT SHORT DRESS,BEIGE/RED,CAD,5670.00
3.074457345618073e+18,2B3VA1L51CF157,Dresses,CREPE COUTURE SHORT DRESS,red,CAD,5540.00
3.074457345618073e+18,2B3VA1P51EC0NO,Dresses,HEAVY LACE DRESS,black,CAD,5540.00
3.074457345618033e+18,1B3VAZF01CF0NO,Dresses,EMBROIDERED CREPE COUTURE DRESS,black,CAD,6300.00
3.074457345618033e+18,1B3VA0097B30NO,Dresses,TIMELESS BOUCLE' DRESS,black,CAD,4410.00
3.074457345618033e+18,1B3VA0101MM7D6,Dresses,CADY COUTURE DRESS,RICH VIOLET,CAD,5040.00
3.0744573456180337e+18,1B3VAZW11CFA03,Dresses,CREPE COUTURE DRESS,ivory,CAD,4410.00
3.074457345618032e+18,1B3KD08S7FUA03,Dresses,EMBROIDERED COTTON DRESS WITH FEATHERS,ivory,CAD,6300.00
3.074457345618033e+18,1B3VAZE71MMA03,Dresses,VLOGO CHAIN CADY COUTURE KAFTAN DRESS,ivory,CAD,4790.00
3.074457345618033e+18,1B3VA0057BFO06,Dresses,GOLD COTTON TWEED DRESS,GOLD/IVORY,CAD,5040.00
3.074457345618033e+18,1B3VA0551CF157,Dresses,CREPE COUTURE DRESS,red,CAD,5290.00
3.0744573456180736e+18,2B3AB4H57N40AN,Shirts and Tops,VALENTINO CHAIN 1967 CREPE DE CHINE SHIRT,ivory/black,CAD,3020.00
3.0744573456180736e+18,2B3AB4F55A6001,Shirts and Tops,COTTON POPELINE SHIRT,optic white,CAD,2270.00
3.0744573456180316e+18,1B3AB3U22UP0NO,Shirts and Tops,CHIFFON BLOUSE,black,CAD,3780.00
3.074457345618073e+18,2B3AB4352UP0NO,Shirts and Tops,CHIFFON BLOUSE,black,CAD,2270.00
3.074457345618032e+18,1B3AB3Y31MH157,Shirts and Tops,GEORGETTE BLOUSE,red,CAD,2650.00
3.074457345618073e+18,2B3AB4352UP157,Shirts and Tops,CHIFFON BLOUSE,red,CAD,2270.00
3.074457345618073e+18,2B3AB4J27SLUL0,Shirts and Tops,TOILE ICONOGRAPHE CREPE DE CHINE BLOUSE,BEIGE/RED,CAD,3020.00
3.0744573456180864e+18,2B0AB4Q65DN157,Shirts and Tops,COMPACT POPELINE BLOUSE,red,CAD,2270.00
3.074457345618073e+18,2B3AB4J27SLE21,Shirts and Tops,TOILE ICONOGRAPHE CREPE DE CHINE BLOUSE,BEIGE/BLACK,CAD,3020.00
3.074457345618073e+18,2B3AE7P57TDE21,Shirts and Tops,TOILE ICONOGRAPHE LIGHT BRALETTE,BEIGE/BLACK,CAD,2270.00
3.0744573456180736e+18,2B3AB4G55A6001,Shirts and Tops,EMBROIDERED COTTON POPELINE SHIRT,optic white,CAD,5290.00
3.0744573456180316e+18,1B3AE7855A6001,Shirts and Tops,COTTON POPELINE TOP,white,CAD,2395.00
3.0744573456180316e+18,1B3AE7551MM157,Shirts and Tops,CADY COUTURE VLOGO CHAIN TOP,red,CAD,3150.00
3.0744573456180736e+18,2B3AB4H15A6K81,Shirts and Tops,EMBROIDERED COTTON POPELINE SHIRT,WHITE/MULTICOLOR,CAD,5670.00
3.0744573456180736e+18,2B3AE8557T2V5R,Shirts and Tops,MANIFESTO BANDANA FOULARD TWILL TOP,YELLOW/MULTICOLOR,CAD,1640.00
3.0744573456180316e+18,1B3AB3Y31MH0BG,Shirts and Tops,GEORGETTE BLOUSE,beige,CAD,2650.00
3.0744573456180736e+18,2B3AB3Y31MHYU4,Shirts and Tops,GEORGETTE BLOUSE,ASTRAL PURPLE,CAD,2650.00
3.0744573456180736e+18,2B3AB3Y31MHFB0,Shirts and Tops,GEORGETTE BLOUSE,green,CAD,2650.00
3.074457345618032e+18,1B3AB3Y31MH7D6,Shirts and Tops,GEORGETTE BLOUSE,RICH VIOLET,CAD,2650.00
3.0744573456180664e+18,1B0AE7L51ED0NO,Shirts and Tops,TOP IN TULLE ILLUSIONE AND LACE,black,CAD,5670.00
3.074457345618073e+18,2B3AB4J27SLUWT,Shirts and Tops,TOILE ICONOGRAPHE CREPE DE CHINE BLOUSE,PINK PP,CAD,3020.00
3.074457345618032e+18,1B3AB3Y31MHA03,Shirts and Tops,GEORGETTE BLOUSE,ivory,CAD,2650.00
3.0744573456180316e+18,1B3AB3T8793G70,Shirts and Tops,LACE SHIRT,gold,CAD,3780.00
3.074457345618073e+18,2B3AE7Z27M2G70,Shirts and Tops,GOLD HEAVY LACE TOP,gold,CAD,4910.00
3.0744573456180736e+18,2B3AE7S61EDG70,Shirts and Tops,TULLE ILLUSIONE EMBROIDERED TOP,gold,CAD,8690.00
3.074457345617986e+18,XB3AE6M61ED0BO,Shirts and Tops,TOP IN TULLE ILLUSIONE AND LACE,white,CAD,4410.00
3.0744573456180736e+18,2B3AE7P47M9YU4,Shirts and Tops,COTTON GUIPURE LACE BRALETTE,ASTRAL PURPLE,CAD,1390.00
3.074457345618073e+18,2B3CG3F57MYE21,Coats And Outerwear,TOILE ICONOGRAPHE CAPE,BEIGE/BLACK,CAD,6930.00
3.074457345618073e+18,2B3CA6F67MYUL0,Coats And Outerwear,TOILE ICONOGRAPHE COAT,BEIGE/RED,CAD,7810.00
3.0744573456180326e+18,1B3NAA357F1A03,Coats And Outerwear,SHEARLING PEACOAT,ivory,CAD,11340.00
3.074457345618073e+18,2B3CA6H57ST0AN,Coats And Outerwear,VALENTINO CHAIN 1967 DOUBLE CREPE COUTURE COAT,ivory/black,CAD,8690.00
3.074457345618073e+18,2B3CJ0U27M7UWT,Coats And Outerwear,TOILE ICONOGRAPHE PEACOAT,PINK PP,CAD,7430.00
3.0744573456180326e+18,1B3KS01V7F5954,Coats And Outerwear,VLOGO CHAIN CAPE IN CASHMERE WOOL,camel,CAD,4660.00
3.074457345618032e+18,1B3CJ2S56JA598,Coats And Outerwear,COMPACT DRAP PEACOAT,navy,CAD,6300.00
3.074457345618032e+18,1B3CA6A06JA598,Coats And Outerwear,COMPACT DRAP COAT,navy,CAD,7560.00
3.074457345618073e+18,2B3KU01K7NY0NO,Coats And Outerwear,WOOL CAPE WITH FEATHERS,black,CAD,7430.00
3.074457345618073e+18,2B3CI0R17M9YU4,Jackets and Blazers,COTTON GUIPURE LACE OVERSHIRT,ASTRAL PURPLE,CAD,4910.00
3.074457345617696e+18,VB0CI0K56DEF30,Jackets and Blazers,FAILLE PEA COAT,pink,CAD,3650.00
3.074457345618073e+18,2B3CI0R17TDE21,Jackets and Blazers,TOILE ICONOGRAPHE LIGHT OVERSHIRT,BEIGE/BLACK,CAD,6930.00
3.074457345617986e+18,XB3CI0R16DET42,Jackets and Blazers,OVERSHIRT IN FAILLE,BRIGHT LIME,CAD,3655.00
3.074457345618032e+18,1B3CI0RF7B90AN,Jackets and Blazers,FAILLE OVERSHIRT WITH ZEBRA 1966 PRINT,ivory/black,CAD,4160.00
3.074457345618073e+18,2B3CE2X51CFNB7,Jackets and Blazers,CREPE COUTURE BLAZER,purple,CAD,5290.00
3.074457345618073e+18,2B3CEE607LV0NA,Jackets and Blazers,LIGHT WOOL TWEED BLAZER,white/ black,CAD,6170.00
3.074457345618073e+18,2B3CE2X56DE0NO,Jackets and Blazers,FAILLE BLAZER,black,CAD,5670.00
3.074457345618073e+18,2B3CE4G77LSO06,Jackets and Blazers,BOUCLE' OPTICAL VALENTINO GOLD BLAZER,GOLD/IVORY,CAD,6930.00
3.074457345618032e+18,1B3CE27L7BFO06,Jackets and Blazers,GOLD COTTON TWEED JACKET,GOLD/IVORY,CAD,9700.00
3.074457345618073e+18,2B3CI0R77LRM12,Jackets and Blazers,VALENTINO GOLDEN WINGS MULTICOLOR BROCADE OVERSHIRT,multicolored,CAD,7430.00
3.074457345618073e+18,2B3CE27N6U8NUD,Jackets and Blazers,EMBROIDERED WOOL TWEED JACKET,NERO/ARGENTO,CAD,8690.00
3.074457345618073e+18,2B3CE28G6U80NO,Jackets and Blazers,VLOGO CHAIN WOOL TWEED JACKET,black,CAD,6930.00
3.074457345618073e+18,2B3CE2Z77TDUL0,Jackets and Blazers,TOILE ICONOGRAPHE LIGHT JACKET,BEIGE/RED,CAD,6170.00
3.074457345618073e+18,2B3CE2LA1CF157,Jackets and Blazers,CREPE COUTURE JACKET,red,CAD,5540.00
3.0744573456177807e+18,WB0CE2L56LR0NO,Jackets and Blazers,DOUBLE COMPACT DRILL PETITE JACKET,black,CAD,3655.00
3.074457345618073e+18,2B3CJ3007LY157,Jackets and Blazers,TEXTURE DOUBLE CREPE PEACOAT,red,CAD,5020.00
3.0744573456180864e+18,2B0KC45I7UALC0,Knitwear,STRETCHED VISCOSE SWEATER,LIGHT CAMEL,CAD,2020.00
3.0744573456180864e+18,2B0KC45I7UAE05,Knitwear,STRETCHED VISCOSE SWEATER,EBONY,CAD,2020.00
3.074457345618073e+18,2B3KE01Z7PVUK4,Knitwear,VISCOSE JACKET WITH CROCHET WORK,ECRU/BROWN/BLACK,CAD,5670.00
3.074457345618073e+18,2B3KC43E7QGA03,Knitwear,VLOGO CHAIN CASHMERE SWEATER,ivory,CAD,3150.00
3.074457345618073e+18,2B3KC42M7S7F93,Knitwear,VALENTINO CHAIN 1967 JACQUARD VISCOSE SWEATER WITH FEATHERS,BROWN/IVORY,CAD,4910.00
3.074457345618073e+18,2B3KC42X7P4O06,Knitwear,MOHAIR LUREX SWEATER,GOLD/IVORY,CAD,4410.00
3.074457345618073e+18,2B3KA05E7RJM12,Knitwear,OPTICAL VALENTINO LUREX JACQUARD CARDIGAN,GOLD/MULTICOLOR,CAD,4160.00
3.074457345618073e+18,2B3KC43Q7RJM12,Knitwear,OPTICAL VALENTINO LUREX JACQUARD SWEATER,GOLD/MULTICOLOR,CAD,2650.00
3.0744573456180326e+18,1B3KC37M7EQ817,Knitwear,V GOLD CASHMERE SWEATER,purple,CAD,2770.00
3.0744573456180326e+18,1B3KC34I7EV817,Knitwear,V GOLD CASHMERE PULLOVER,purple,CAD,2645.00
3.074457345618073e+18,2B3KC42Y7Q3NB7,Knitwear,EMBROIDERED LUREX SWEATER,purple,CAD,6930.00
3.074457345618073e+18,2B3KA05H7MP953,Knitwear,EMBROIDERED MOHAIR LUREX CARDIGAN,CAMEL/GOLD,CAD,6170.00
3.074457345618032e+18,1B3KA04U7G8954,Knitwear,EMBROIDERED WOOL CARDIGAN WITH FEATHERS,camel,CAD,5670.00
3.0744573456180326e+18,1B3KC34I7EV954,Knitwear,V GOLD CASHMERE PULLOVER,camel,CAD,2645.00
3.0744573456177377e+18,WB3KCC276MF954,Knitwear,CASHMERE SWEATER,camel,CAD,2140.00
3.074457345618073e+18,2B3KC42A7PK157,Knitwear,WOOL SWEATER WITH VLOGO SIGNATURE BELT DETAIL,red,CAD,2270.00
3.074457345618073e+18,2B3KE02D7P00NO,Knitwear,MOHAIR JACKET,black,CAD,5540.00
3.0744573456177377e+18,WB3KCC276MF0NO,Knitwear,CASHMERE SWEATER,black,CAD,2140.00
3.074457345618073e+18,2B3KC42A7PK0NO,Knitwear,WOOL SWEATER WITH VLOGO SIGNATURE BELT DETAIL,black,CAD,2270.00
3.0744573456180326e+18,1B3KC37N7ER0NO,Knitwear,VLOGO CHAIN CASHMERE SWEATER,black,CAD,3150.00
3.074457345618022e+18,XB0KC27X6R2A03,Knitwear,EMBROIDERED WOOL SWEATER,ivory,CAD,2770.00
3.0744573456180326e+18,1B3KC37M7EQA03,Knitwear,V GOLD CASHMERE SWEATER,ivory,CAD,2770.00
3.0744573456177377e+18,WB3KCC276MFA03,Knitwear,CASHMERE SWEATER,ivory,CAD,2140.00
3.0744573456180864e+18,2B0MC00Z7V8CZ0,T-shirts and Sweatshirts,TOILE ICONOGRAPHE JERSEY TOP,BEIGE/RED,CAD,1640.00
3.0744573456180864e+18,2B0MR00Q7VRCZ0,T-shirts and Sweatshirts,TOILE ICONOGRAPHE JERSEY BODYSUIT,BEIGE/RED,CAD,1640.00
3.0744573456180864e+18,2B0MR00Q7VRSN0,T-shirts and Sweatshirts,TOILE ICONOGRAPHE JERSEY BODYSUIT,BEIGE/BLACK,CAD,1640.00
3.0744573456180864e+18,2B0MR00N7V7E05,T-shirts and Sweatshirts,JERSEY BODYSUIT,EBONY,CAD,1070.00
3.074457345618073e+18,2B3MF21K7TB0BO,T-shirts and Sweatshirts,EMBROIDERED JERSEY SWEATSHIRT,WHITE/MULTICOLOR,CAD,2650.00
3.074457345618073e+18,2B3MF21C7PS0BO,T-shirts and Sweatshirts,EMBROIDERED JERSEY SWEATSHIRT,white,CAD,3150.00
3.074457345618073e+18,2B3MF21B7PR0NO,T-shirts and Sweatshirts,EMBROIDERED JERSEY SWEATSHIRT,BLACK/MULTICOLOR,CAD,4410.00
3.074457345618073e+18,2B3MF20Y7PFL01,T-shirts and Sweatshirts,VLOGO CHAIN JERSEY LUREX SWEATSHIRT,gold,CAD,3020.00
3.074457345618073e+18,2B3MG20V7T70BO,T-shirts and Sweatshirts,EMBROIDERED JERSEY T-SHIRT,WHITE/MULTICOLOR,CAD,1510.00
3.074457345617987e+18,XB3MG16X73M0BO,T-shirts and Sweatshirts,EMBROIDERED JERSEY T-SHIRT,WHITE/MULTICOLOR,CAD,1120.00
3.074457345618073e+18,2B3MG20J7Q7UWT,T-shirts and Sweatshirts,EMBROIDERED JERSEY T-SHIRT,PINK PP,CAD,1510.00
3.074457345618073e+18,2B3MG20J7Q7NB7,T-shirts and Sweatshirts,EMBROIDERED JERSEY T-SHIRT,purple,CAD,1510.00
3.074457345618032e+18,1B3MF18V7CK0BO,T-shirts and Sweatshirts,EMBROIDERED JERSEY HOODIE,white,CAD,2255.00
3.0744573456180326e+18,1B3MG18W7DN0BO,T-shirts and Sweatshirts,EMBROIDERED JERSEY T-SHIRT,white,CAD,1385.00
3.074457345618068e+18,1V0MF20I8YBUWT,T-shirts and Sweatshirts,"COTTON SWEATSHIRT ""WITH BEAUTY HAS KIND OF BECOME AN ACT OF REBELLION"" PRINT BY DOUGLAS COUPLAND",PINK PP,CAD,1580.00
3.074457345618068e+18,1V0MG10V8YCUWT,T-shirts and Sweatshirts,"COTTON T-SHIRT WITH ""MY BRAIN FEELS LIKE FRIDGE MAGNET POETRY"" PRINT BY DOUGLAS COUPLAND",PINK PP,CAD,950.00
3.0744573456180285e+18,WB3MG07D3V6A01,T-shirts and Sweatshirts,VLTN T-SHIRT,white/ black,CAD,710.00
3.0744573456180275e+18,UB3MG07D3V6A33,T-shirts and Sweatshirts,VLTN T-SHIRT,white/red,CAD,710.00
3.0744573456180285e+18,WB3MG07D3V60NI,T-shirts and Sweatshirts,VLTN T-SHIRT,black/white,CAD,710.00
3.074457345618073e+18,2B3DA01V7MR558,Denim,CHAMBRAY DENIM LONG DRESS,BLUE,CAD,5920.00
3.074457345618073e+18,2B3DB01Z7MR558,Denim,CHAMBRAY DENIM CAFTAN DRESS,BLUE,CAD,3020.00
3.074457345618073e+18,2B3DB01V7MR558,Denim,CHAMBRAY DENIM SHIRT WITH FEATHERS,BLUE,CAD,4410.00
3.074457345617986e+18,XB3DB01J433558,Denim,CHAMBRAY DENIM KAFTAN TOP,BLUE,CAD,1765.00
3.074457345617986e+18,XB3DB01I433558,Denim,CHAMBRAY DENIM KAFTAN,BLUE,CAD,2255.00
3.074457345617986e+18,XB3DH00D433558,Denim,JUMPSUIT IN CHAMBRAY DENIM,BLUE,CAD,3025.00
3.074457345617986e+18,XB3DB01L72P508,Denim,CHAMBRAY DENIM LONG KAFTAN,light blue,CAD,2900.00
3.074457345618032e+18,1B3DC02T79W0NO,Denim,EMBROIDERED DENIM JACKET WITH FEATHERS,black,CAD,4410.00
3.074457345618073e+18,2B3DD15A7MR558,Denim,DENIM CHAMBRAY SHORTS,BLUE,CAD,1760.00
3.074457345618073e+18,2B3DD14N7N1528,Denim,DEEP BLUE DENIM SHORTS,BLUE,CAD,1640.00
3.0744573456180393e+18,1B3DD13S79E558,Denim,DENIM SHORTS,BLUE,CAD,1245.00
3.074457345617986e+18,XB3DD12T433558,Denim,CHAMBRAY DENIM SHORTS,BLUE,CAD,1120.00
3.074457345618073e+18,2B3DD14Z7MR558,Denim,DENIM CHAMBRAY PANTS,BLUE,CAD,2270.00
3.074457345618073e+18,2B3DD14V7MT558,Denim,MEDIUM BLUE DENIM PANTS,BLUE,CAD,1760.00
3.074457345618073e+18,2B3DD14S7MT558,Denim,VLOGO CHAIN MEDIUM BLUE DENIM PANTS,BLUE,CAD,2390.00
3.0744573456180393e+18,1B3DD13U79E558,Denim,BLUE WASHED DENIM JEANS,BLUE,CAD,1640.00
3.074457345617986e+18,XB3DD12V433558,Denim,JEANS IN CHAMBRAY DENIM,BLUE,CAD,1640.00
3.074457345618032e+18,1B3DD14C79W0NO,Denim,DENIM JEANS EMBROIDERED WITH FEATHERS,black,CAD,3780.00
3.074457345618073e+18,2B3DD14W7N3558,Denim,VLOGO CHAIN MEDIUM BLUE DENIM PANTS,BLUE,CAD,2270.00
3.074457345618073e+18,2B3RA9B51MM0NO,Skirts,CADY COUTURE LONG SKIRT,black,CAD,5670.00
3.074457345618073e+18,2B3RA9A87N57A5,Skirts,VALENTINO CHAIN 1967 CREPE COUTURE MIDI SKIRT,CHESTNUT CREAM/IVORY,CAD,3780.00
3.074457345618073e+18,2B3MD05M7NNL01,Skirts,JERSEY LUREX SKIRT,gold,CAD,3400.00
3.074457345618073e+18,2B3RA9977TEUWT,Skirts,TOILE ICONOGRAPHE LIGHT SKIRT,PINK PP,CAD,3020.00
3.074457345618073e+18,2B3RA9H86U8NUD,Skirts,EMBROIDERED WOOL TWEED SKIRT,NERO/ARGENTO,CAD,4910.00
3.074457345618073e+18,2B3RA9B01CF0NO,Skirts,CREPE COUTURE SKIRT,black,CAD,2390.00
3.074457345618073e+18,2B3RA9967LY157,Skirts,TEXTURE DOUBLE CREPE SKIRT,red,CAD,2270.00
3.0744573456177807e+18,WB0RA8701CF0NO,Skirts,CREPE COUTURE SKIRT,black,CAD,1890.00
3.074457345617987e+18,XB3RA8E51CF0NO,Skirts,CREPE COUTURE MINI SKORT,black,CAD,1875.00
3.074457345618073e+18,2B3RF2A97TDE21,Pants And Shorts,TOILE ICONOGRAPHE LIGHT SHORTS,BEIGE/BLACK,CAD,2770.00
3.074457345618033e+18,1B3RF2641CF0NO,Pants And Shorts,CREPE COUTURE SHORTS,black,CAD,1385.00
3.074457345618074e+18,2B3RF2A57M853P,Pants And Shorts,VALENTINO CHAIN 1967 BROCADE SHORTS,WHITE/GOLD,CAD,2390.00
3.074457345618074e+18,2B3RF2A87N50NA,Pants And Shorts,VALENTINO CHAIN 1967 CREPE COUTURE SHORTS,white/ black,CAD,2390.00
3.074457345618074e+18,2B3RF13T7M9YU4,Pants And Shorts,COTTON GUIPURE LACE SHORTS,ASTRAL PURPLE,CAD,2270.00
3.074457345618074e+18,2B3RF2957M0001,Pants And Shorts,COTTON COUTURE TWEED SHORTS,optic white,CAD,1760.00
3.074457345618074e+18,2B3RF2A17LSO06,Pants And Shorts,BOUCLE' OPTICAL VALENTINO GOLD SHORTS,GOLD/IVORY,CAD,2270.00
3.074457345618033e+18,1B3RF2677BFO06,Pants And Shorts,GOLD COTTON TWEED SHORTS,GOLD/IVORY,CAD,2015.00
3.074457345618074e+18,2B3RF2A07LRM12,Pants And Shorts,VALENTINO GOLDEN WINGS MULTICOLOR BROCADE SHORTS,multicolored,CAD,2390.00
3.074457345617987e+18,2B3RF1V51CF0NO,Pants And Shorts,CREPE COUTURE V GOLD SHORTS,black,CAD,1640.00
3.074457345618074e+18,2B3RF2E26U80NO,Pants And Shorts,VLOGO CHAIN WOOL TWEED SHORTS,black,CAD,2270.00
3.0744573456180326e+18,1B3RF23679YG70,Pants And Shorts,CRISPY GOLD VLOGO CHAIN SHORTS,gold,CAD,2270.00
3.0744573456180326e+18,1B3RF2351CFA03,Pants And Shorts,VLOGO CHAIN CREPE COUTURE SHORTS,ivory,CAD,1765.00
3.0744573456180874e+18,2B0RB5D05DN157,Pants And Shorts,COMPACT POPELINE PANTS,red,CAD,2020.00
3.074457345618074e+18,2B3RB5651CFNB7,Pants And Shorts,CREPE COUTURE PANTS,purple,CAD,3150.00
3.074457345618074e+18,2B3RB5651CFFB0,Pants And Shorts,CREPE COUTURE PANTS,green,CAD,3150.00
3.074457345618074e+18,2B3RB5C67T2V5R,Pants And Shorts,MANIFESTO BANDANA FOULARD TWILL PANTS,YELLOW/MULTICOLOR,CAD,3150.00
3.074457345618073e+18,2B3KF00T7S7F93,Pants And Shorts,VALENTINO CHAIN 1967 JACQUARD VISCOSE PANTS WITH FEATHERS,BROWN/IVORY,CAD,4410.00
3.074457345618074e+18,2B3RB4M67LSO06,Pants And Shorts,BOUCLE' OPTICAL VALENTINO GOLD PANTS,GOLD/IVORY,CAD,3530.00
3.074457345618074e+18,2B3RB5327M6G70,Pants And Shorts,VALENTINO GOLDEN WINGS BROCADE PANTS,gold,CAD,4790.00
3.074457345618074e+18,2B3RB5997M2G70,Pants And Shorts,GOLD HEAVY LACE PANTS,gold,CAD,4910.00
3.074457345618074e+18,2B3RB3631CF0NO,Pants And Shorts,CREPE COUTURE VLOGO CHAIN PANTS,black,CAD,3020.00
3.074457345618074e+18,2B3RB3631CF157,Pants And Shorts,CREPE COUTURE VLOGO CHAIN PANTS,red,CAD,3020.00
3.074457345617987e+18,XB3RB3651CFA03,Pants And Shorts,CREPE COUTURE PANTS,ivory,CAD,2380.00
3.074457345617987e+18,XB3RB3651CF0NO,Pants And Shorts,CREPE COUTURE PANTS,black,CAD,2380.00
3.074457345617697e+18,VW0S0393YPXI16,Pumps,ROCKSTUD ANKLE STRAP PATENT-LEATHER PUMP WITH TONAL STUDS 100 MM,light ivory,CAD,1390.00
3.0744573456167383e+18,ZW2S0393VNWN91,Pumps,Patent Rockstud Caged Pump 100mm,black/poudre,CAD,1390.00
3.0744573456180756e+18,2W2S0393VNWYU7,Pumps,PATENT ROCKSTUD CAGED PUMP 100MM,CANDY ROSE/POUDRE,CAD,1390.00
3.0744573456167444e+18,ZW2S0393VNWP45,Pumps,Patent Rockstud Caged Pump 100mm,poudre,CAD,1390.00
3.0744573456167383e+18,ZW2S0393VNWL62,Pumps,Patent Rockstud Caged Pump 100mm,light ivory/poudre,CAD,1390.00
3.0744573456167383e+18,ZW2S0393VODP45,Pumps,Rockstud ankle strap pump 100 mm,poudre,CAD,1390.00
3.0744573456180756e+18,2W2S0393UNLV7F,Pumps,ROCKSTUD TWEED PUMP WITH STRAPS 100MM,GOLD/MULTICOLOR,CAD,1500.00
3.0744573456180756e+18,2W2S0393AGPJZE,Pumps,ROCKSTUD RAFFIA PUMP WITH STRAPS 100MM,gold,CAD,1500.00
3.0744573456176215e+18,2W2S0393NNFS69,Pumps,Rockstud Metallic Ankle Strap Pump 100 mm,skin,CAD,1390.00
3.0744573456176236e+18,ZW2S0393VCE0NO,Pumps,Rockstud Grainy Calfskin Ankle Strap Pump 100  mm,black,CAD,1390.00
3.074457345618023e+18,XW0S0393QTPFG4,Pumps,SATIN ROCKSTUD PUMP WITH ALL-OVER TUBES EMBROIDERY AND STRAPS 100MM,pink,CAD,1575.00
3.074457345618023e+18,XW0S0393QTP0NO,Pumps,SATIN ROCKSTUD PUMP WITH ALL-OVER TUBES EMBROIDERY AND STRAPS 100MM,black,CAD,1575.00
3.0744573456167383e+18,ZW2S0375VNWN91,Pumps,Rockstud Caged Pump 65mm,black/poudre,CAD,1390.00
3.074457345618027e+18,2W2S0375VNWL62,Pumps,Rockstud Caged Pump 65mm,light ivory/poudre,CAD,1390.00
3.0744573456167383e+18,ZW2S0375VNWP45,Pumps,Rockstud Caged Pump 65mm,poudre,CAD,1390.00
3.074457345618038e+18,1W2S0FI5VNWN91,Pumps,ROCKSTUD PLATFORM PUMP IN PATENT LEATHER 155 MM,black/poudre,CAD,1600.00
3.074457345618038e+18,1W2S0FI5VNWP45,Pumps,ROCKSTUD PLATFORM PUMP IN PATENT LEATHER 155 MM,poudre,CAD,1600.00
3.0744573456180767e+18,2W2S0R01QJGND3,Pumps,VLOGO SIGNATURE SLINGBACK PUMP IN TRANSPARENT POLYMER MATERIAL 80MM,SADDLE BROWN/TRANSPARENT,CAD,1390.00
3.0744573456180767e+18,2W2S0R01QJGYL0,Pumps,VLOGO SIGNATURE SLINGBACK PUMP IN TRANSPARENT POLYMER MATERIAL 80MM,OPTICAL WHITE/TRANSPARENT,CAD,1390.00
3.0744573456180767e+18,2W2S0R01ARRKM5,Pumps,VLOGO SIGNATURE SLINGBACK PUMP IN WOVEN METALLIC NAPPA AND CRYSTALS 80MM,antique brass,CAD,3140.00
3.0744573456180767e+18,2W2S0R01SHDV7F,Pumps,VLOGO SIGNATURE SLINGBACK PUMP IN WOVEN METALLIC NAPPA 80MM,GOLD/MULTICOLOR,CAD,1760.00
3.074457345618038e+18,1W2S0R01IDUUWY,Pumps,VLOGO SIGNATURE SATIN SLINGBACK PUMPS 80MM,GREEN/CRYSTAL,CAD,2500.00
3.074457345618038e+18,1W2S0R01IDU249,Pumps,VLOGO SIGNATURE SATIN SLINGBACK PUMPS 80MM,black,CAD,2500.00
3.074457345617222e+18,XW2S0R01PVYP18,Pumps,VLogo Glow Laminated Nappa Slingback Pump 80 mm / 3.15 in.,platinum,CAD,1950.00
3.074457345618038e+18,1W2S0R01IDUV8H,Pumps,VLOGO SIGNATURE SATIN SLINGBACK PUMPS 80MM,ROSE VIOLET,CAD,2500.00
3.074457345617222e+18,ZW2S0R01MZF0NO,Pumps,VLogo Signature Calfskin Slingback Pump 80 mm / 3.15 in.,black,CAD,1240.00
3.074457345617222e+18,ZW2S0R01MZFP45,Pumps,VLogo Signature Calfskin Slingback Pump 80 mm / 3.15 in.,poudre,CAD,1240.00
3.07445734561803e+18,1W2S0R01TMK0NO,Pumps,VLogo Signature Patent Leather Slingback Pump 80mm / 3.15 in.,black,CAD,1750.00
3.0744573456177137e+18,VW0S0R01TMKGF9,Pumps,VLogo Signature Patent Leather Slingback Pump 80mm / 3.15 in.,rose cannelle,CAD,1750.00
