product_id,product_code,product_type,item_name,color,Currency,Value
3.0744573456180874e+18,2W0B0K53IYSK4S,WOMAN,LOCÒ CALFSKIN SHOULDER BAG,POWDER ROSE,CAD,3210.00
3.0744573456180864e+18,2B0CEE367TQS69,WOMAN,BLAZER IN EMBROIDERED TECHNO WEAVE,sand,CAD,7060.00
,2B0RB5D07TQS69,WOMAN,TECHNO WEAVE PANTS,,CAD,2650.00
3.0744573456180864e+18,2B0MR00N7V7S69,WOMAN,JERSEY BODYSUIT,sand,CAD,1070.00
3.074457345618084e+18,2W0S0393NWG7AF,WOMAN,ROCKSTUD PUMPS IN PATENT LEATHER AND POLYMERIC MATERIAL WITH STRAPS 100MM,PINK/TRANSPARENT,CAD,1580.00
3.0744573456180874e+18,2W0B0K30IYSGF9,WOMAN,LOCÒ CALFSKIN SHOULDER BAG,rose cannelle,CAD,3590.00
3.0744573456180864e+18,2B0AB4X07W1155,WOMAN,SARTORIAL POPELINE SHIRT,WHITE/SAND,CAD,2650.00
,2B0RA9V56D1S69,WOMAN,TECHNO DUCHESSE MIDI SKIRT,,CAD,5670.00
3.0744573456180874e+18,2B0VA3X06D1S69,WOMAN,SHORT DRESS IN TECHNO DUCHESSE,sand,CAD,5290.00
3.074457345616733e+18,2W2S0393VB8P45,WOMAN,Rockstud Ankle Strap Pump with Tonal Studs 100  mm,poudre,CAD,1390.00
3.0744573456180884e+18,2W0T0X49ABAKG8,WOMAN,VLOGO SIGNATURE BELT IN SHINY CALFSKIN 30MM,fondant,CAD,820.00
3.0744573456180874e+18,2W0J0T21YCW6RX,WOMAN,VLOGO SIGNATURE EARRINGS,PALLADIUM/SILVER,CAD,2730.00
3.0744573456180864e+18,2B0CA6M374BMUS,WOMAN,EMBROIDERED DRY TAILORING WOOL COAT,TUSCAN SUN,CAD,10710.00
3.0744573456180874e+18,2W0S0DT4KCCK4S,WOMAN,ONE STUD PATENT LEATHER PUMP WITH MATCHING STUD 90 MM,POWDER ROSE,CAD,1240.00
3.0744573456180864e+18,2B0MR00S7WMS69,WOMAN,JERSEY BODYSUIT,sand,CAD,1030.00
3.0744573456180884e+18,2B0RA9V074BMUS,WOMAN,DRY TAILORING WOOL SKIRT,TUSCAN SUN,CAD,6680.00
3.0744573456180874e+18,2W0S0GX1HCWK4S,WOMAN,ROCKSTUD PATENT-LEATHER PUMP 90 MM,POWDER ROSE,CAD,1160.00
3.0744573456180874e+18,2W0B0K53QDDMZT,WOMAN,SMALL LOCÒ SHOULDER BAG WITH CRYSTALS,LEMON,CAD,6170.00
,2W0T0X49ABAK4S,WOMAN,VLOGO SIGNATURE BELT IN SHINY CALFSKIN 30MM,,CAD,820.00
3.0744573456180874e+18,2W0B0K53ZXLN5A,WOMAN,LOCÒ SMALL SHOULDER BAG IN CALFSKIN,yellow,CAD,3090.00
3.0744573456180874e+18,2B0VA3L67SLE21,WOMAN,MIDI DRESS IN TOILE ICONOGRAPHE CREPE DE CHINE,BEIGE/BLACK,CAD,8690.00
3.074457345618073e+18,2B3KI00N7T3E21,WOMAN,TOILE ICONOGRAPHE TULLE TIGHTS,BEIGE/BLACK,CAD,490.00
3.0744573456180884e+18,2W0S0R01EBH6ZN,WOMAN,VLOGO SIGNATURE SLINGBACK PUMP IN TOILE ICONOGRAPHE 80MM,BEIGE/BLACK,CAD,1240.00
3.074457345618083e+18,2W0B0L97JSQ6ZN,WOMAN,SMALL LOCÒ TOILE ICONOGRAPHE SHOULDER BAG,BEIGE/BLACK,CAD,3090.00
3.0744573456180874e+18,2W0S0GT4BBQ2P0,WOMAN,TOILE ICONOGRAPHE PUMP IN POLYMER AND PATENT MATERIAL 90MM,BLACK/TRANSPARENT,CAD,1510.00
3.0744573456180756e+18,2W2B0L29HUJ6ZN,WOMAN,LA TROISIEME TOILE ICONOGRAPHE SHOPPING BAG,BEIGE/BLACK,CAD,3390.00
3.0744573456180874e+18,2W0GCA24DHXE21,WOMAN,TOILE ICONOGRAPHE LONG GLOVES IN TULLE,BEIGE/BLACK,CAD,620.00
3.0744573456180874e+18,2W0P0Z11VRI6ZN,WOMAN,LOCÒ TOILE ICONOGRAPHE PHONE CASE WITH CHAIN,BEIGE/BLACK,CAD,1450.00
3.0744573456180874e+18,2B0VA3Y01CF0NO,WOMAN,CREPE COUTURE SHORT DRESS,black,CAD,5290.00
3.0744573456180874e+18,2W0J0T05ZLQY79,WOMAN,ROCKSTUD METAL CHOKER,brown,CAD,3260.00
3.0744573456180874e+18,2B0VA3Q01CF0NO,WOMAN,CREPE COUTURE SHORT DRESS,black,CAD,5670.00
3.0744573456180874e+18,2W0S0GX1HCWE05,WOMAN,ROCKSTUD PATENT-LEATHER PUMP 90 MM,EBONY,CAD,1160.00
3.0744573456180874e+18,2B0VA3B35A6155,WOMAN,COTTON POPELINE SHORT DRESS,WHITE/SAND,CAD,4410.00
3.0744573456180884e+18,2W0T0X47ABAGF9,WOMAN,VLOGO SIGNATURE BELT IN SHINY CALFSKIN 20MM,rose cannelle,CAD,720.00
3.0744573456180874e+18,2W0J0T05ZLQLC0,WOMAN,ROCKSTUD METAL CHOKER,LIGHT CAMEL,CAD,3260.00
,2W0J0T07ZLQLC0,WOMAN,ROCKSTUD METAL EARRINGS,,CAD,1070.00
3.0744573456180864e+18,2B0CEE357TQLC0,WOMAN,EMBROIDERED TECHNO WEAVE BLAZER,LIGHT CAMEL,CAD,8190.00
3.0744573456180884e+18,2W0B0M00QGXGF9,WOMAN,LE TROISIÈME RUBBER SHOPPING BAG,rose cannelle,CAD,2080.00
3.0744573456180874e+18,2B0RF2F07TQLC0,WOMAN,TECHNO WEAVE SHORTS,LIGHT CAMEL,CAD,1640.00
3.0744573456180874e+18,2W0J0E35JXFY79,WOMAN,VLOGO SIGNATURE METAL EARRINGS WITH SWAROVSKI® PEARLS,brown,CAD,470.00
3.0744573456180864e+18,2B0MR00Q7VRMUX,WOMAN,TOILE ICONOGRAPHE JERSEY BODYSUIT,LIGHT CAMEL/BLACK,CAD,1640.00
3.0744573456180864e+18,2B0RA9V67UWMUX,WOMAN,TOILE ICONOGRAPHE FAILLE MIDI SKIRT,LIGHT CAMEL/BLACK,CAD,6930.00
,2W0J0T07ZLQY79,WOMAN,ROCKSTUD METAL EARRINGS,,CAD,1070.00
3.0744573456180864e+18,2B0ME00V7V6MUX,WOMAN,TOILE ICONOGRAPHE JERSEY JUMPSUIT,LIGHT CAMEL/BLACK,CAD,3150.00
3.0744573456180864e+18,2B0CE2N374BS69,WOMAN,DRY TAILORING WOOL EMBROIDERED BLAZER,sand,CAD,6550.00
3.0744573456180874e+18,2B0RB52074BS69,WOMAN,DRY TAILORING WOOL PANTS,sand,CAD,2260.00
3.0744573456180874e+18,2W0B0K53ANFMZD,WOMAN,LOCÒ EMBROIDERED SMALL SHOULDER BAG,ROSE MIST,CAD,5670.00
3.0744573456180864e+18,2B0MR00S7WMLC0,WOMAN,JERSEY BODYSUIT,LIGHT CAMEL,CAD,1030.00
3.0744573456180864e+18,2B0KC45I7UAS69,WOMAN,STRETCHED VISCOSE SWEATER,sand,CAD,2020.00
3.0744573456180874e+18,2B0RB52074BLC0,WOMAN,DRY TAILORING WOOL PANTS,LIGHT CAMEL,CAD,2260.00
3.0744573456180864e+18,2B0MR00N7V7LC0,WOMAN,JERSEY BODYSUIT,LIGHT CAMEL,CAD,1070.00
3.0744573456180884e+18,2W0B0M00QGXK4S,WOMAN,LE TROISIÈME RUBBER SHOPPING BAG,POWDER ROSE,CAD,2080.00
3.0744573456180864e+18,2B0AB4X07W1MTH,WOMAN,SARTORIAL POPELINE SHIRT,WHITE/LIGHT CAMEL,CAD,2650.00
3.0744573456180864e+18,2B0VA3V06D1E05,WOMAN,SHORT DRESS IN TECHNO DUCHESSE,EBONY,CAD,4910.00
3.074457345616733e+18,2W2S0393VB80NO,WOMAN,Rockstud Ankle Strap Pump with Tonal Studs 100  mm,black,CAD,1390.00
,2B0VA3551ED0NO,WOMAN,TULLE ILLUSIONE EMBROIDERED SHORT DRESS,,CAD,18270.00
3.0744573456180864e+18,2B0CI0R17UWMUX,WOMAN,OVERSHIRT IN TOILE ICONOGRAPHE FAILLE,LIGHT CAMEL/BLACK,CAD,5670.00
3.0744573456180874e+18,2W0B0K53LBB08Y,WOMAN,SMALL LOCÒ SHOULDER BAG WITH CRYSTALS,black,CAD,6170.00
3.0744573456180864e+18,2B0MC00Z7V8MUX,WOMAN,TOILE ICONOGRAPHE JERSEY TOP,LIGHT CAMEL/BLACK,CAD,1640.00
3.0744573456180864e+18,2B0RF1Z07UWMUX,WOMAN,SHORTS IN TOILE ICONOGRAPHE FAILLE,LIGHT CAMEL/BLACK,CAD,2270.00
,2B0AB4X07W17D3,WOMAN,SARTORIAL POPELINE SHIRT,,CAD,2650.00
3.0744573456180864e+18,2B0RA9V56D1E05,WOMAN,TECHNO DUCHESSE MIDI SKIRT,EBONY,CAD,5670.00
3.074457345618084e+18,2W0S0393AAU6LP,WOMAN,ROCKSTUD PUMPS IN PATENT LEATHER AND POLYMERIC MATERIAL WITH STRAPS 100MM,BLACK/TRANSPARENT,CAD,1580.00
3.0744573456180874e+18,2W0B0M02INMLC0,WOMAN,ENAMELED STUD MINAUDIÈRE,LIGHT CAMEL,CAD,4280.00
3.0744573456180864e+18,2B0VA3B35A67D3,WOMAN,COTTON POPELINE SHORT DRESS,WHITE/EBONY,CAD,4410.00
3.074457345618083e+18,2W0B0L96JSQ6ZN,WOMAN,LOCÒ TOILE ICONOGRAPHE SHOULDER BAG,BEIGE/BLACK,CAD,3400.00
3.0744573456180864e+18,2B0AB4S07W1001,WOMAN,SARTORIAL POPLIN SHIRT,white,CAD,2390.00
3.0744573456180874e+18,2W0B0L90HUJ6ZN,WOMAN,LE TROISIÈME MINI SHOPPING BAG IN TOILE ICONOGRAPHE,BEIGE/BLACK,CAD,2650.00
3.0744573456180864e+18,2B0VE2N51MME05,WOMAN,CADY COUTURE JUMPSUIT,EBONY,CAD,6170.00
3.0744573456180874e+18,2W0S0DQ3LAVV6L,WOMAN,VALENTINO GARAVANI TAN-GO PLATFORM PUMPS IN POLYMER MATERIAL WITH PLEXI HEEL 155MM,PINK/TRANSPARENT,CAD,2260.00
3.0744573456180864e+18,2B0MR00S7WME05,WOMAN,JERSEY BODYSUIT,EBONY,CAD,1030.00
,2W0B0K53EMSMUX,WOMAN,SMALL LOCÒ SHOULDER BAG WITH TOILE ICONOGRAPHE EMBROIDERY,,CAD,5670.00
3.0744573456180874e+18,2V0CE3668EJLC0,MAN,SINGLE-BREASTED WOOL JACKET WITH MAISON VALENTINO TAILORING LABEL AND CHIFFON INNER BIB,LIGHT CAMEL,CAD,3970.00
3.0744573456180884e+18,2Y0S0H01UAKGF9,MAN,TOTALOOP NYLON AND LEATHER HIGH-TOP SNEAKER,rose cannelle,CAD,1220.00
3.0744573456180884e+18,2Y0J0Q47MET172,MAN,VLOGO TYPE METAL RING,PALLADIUM,CAD,470.00
3.0744573456180874e+18,2V0MG13Y9CUS69,MAN,VALENTINO PRINT CREWNECK LYCRA TOP,SKIN,CAD,1120.00
3.0744573456180874e+18,2V0RBK208J5S69,MAN,NYLON CARGO PANTS,SKIN,CAD,1700.00
3.0744573456180874e+18,2V0CIN508J5S69,MAN,NYLON JACKET,SKIN,CAD,2960.00
3.0744573456180884e+18,2Y0P0U36WWH6ZN,MAN,LOCO' TOILE ICONOGRAPHE POUCH,BEIGE/BLACK,CAD,1350.00
3.0744573456180874e+18,2V0CJI209D0MYL,MAN,SILK FAILLE CREW NECK T-SHIRT WITH ALL-OVER TOILE ICONOGRAPHE PRINT,BEIGE/BLACK,CAD,3470.00
3.0744573456180874e+18,2V0RDK219D0MYL,MAN,ALL-OVER TOILE ICONOGRAPHE PRINT SILK FAILLE BERMUDA SHORTS,BEIGE/BLACK,CAD,2580.00
3.0744573456180884e+18,2Y0S0H04PGB0NO,MAN,ROCKSTUD ESSENTIAL CALF LEATHER DERBY,black,CAD,1450.00
3.0744573456180884e+18,2Y0B0B63PMJ6ZN,MAN,MINI LOCÒ TOILE ICONOGRAPHE SHOULDER BAG,BEIGE/BLACK,CAD,2760.00
3.0744573456180884e+18,2Y0S0H02RWC6ZN,MAN,TOILE ICONOGRAPHE TOTALOOP LOW-TOP SNEAKER,BEIGE/BLACK,CAD,1120.00
3.0744573456180884e+18,2Y0P0U34WWH6ZN,MAN,LOCÒ TOILE ICONOGRAPHE CROSSBODY MINI BAG,BEIGE/BLACK,CAD,1450.00
3.0744573456180884e+18,2Y0B0C08MDG6ZN,MAN,LE TROISIEME TOILE ICONOGRAPHE SHOPPING BAG,BEIGE/BLACK,CAD,3400.00
3.0744573456180884e+18,2Y0T0SB3BQB6ZN,MAN,TOILE ICONOGRAPHE BELT WITH LEATHER DETAILING,BEIGE/BLACK,CAD,840.00
3.0744573456180864e+18,2V0AAA909DNMYW,MAN,ALL-OVER TOILE ICONOGRAPHE PRINT SHORT SLEEVE SHIRT,EBONY/BLACK,CAD,2080.00
3.0744573456180884e+18,2Y0B0C08JXDU02,MAN,LE TROISIEME TOILE ICONOGRAPHE SHOPPING BAG,FONDANTBLACK,CAD,3400.00
3.0744573456180905e+18,2Y0P0U36WWHU02,MAN,LOCO' TOILE ICONOGRAPHE POUCH,FONDANTBLACK,CAD,1350.00
3.0744573456180884e+18,2Y0J0Q42MET172,MAN,VLOGO TYPE METAL EARRINGS,PALLADIUM,CAD,590.00
3.0744573456180864e+18,2V0AAA909DNMYV,MAN,ALL-OVER TOILE ICONOGRAPHE PRINT SHORT SLEEVE SHIRT,BEIGE/RED,CAD,2080.00
3.0744573456180874e+18,2V0RDK219D0MYV,MAN,ALL-OVER TOILE ICONOGRAPHE PRINT SILK FAILLE BERMUDA SHORTS,BEIGE/RED,CAD,2580.00
3.0744573456180884e+18,2Y0S0H02RWCJ4A,MAN,TOILE ICONOGRAPHE TOTALOOP LOW-TOP SNEAKER,BEIGE/RED,CAD,1120.00
3.0744573456180874e+18,2V0CJH659D0MYV,MAN,SILK FAILLE ANORAK WITH ALL-OVER TOILE ICONOGRAPHE PRINT,BEIGE/RED,CAD,4780.00
3.0744573456180874e+18,2V0VE2L69D0MYW,MAN,SILK FAILLE JUMPSUIT WITH ALL-OVER TOILE ICONOGRAPHE PRINT,EBONY/BLACK,CAD,5990.00
3.0744573456180864e+18,2V0AB3L09DNMYL,MAN,SILK SHIRT WITH NECK TIE AND ALL-OVER TOILE ICONOGRAPHE PRINT,BEIGE/BLACK,CAD,2580.00
3.0744573456180884e+18,2Y0S0H04PGBGF9,MAN,ROCKSTUD ESSENTIAL CALF LEATHER DERBY,rose cannelle,CAD,1450.00
3.0744573456180874e+18,2V0MG14W9DFLC0,MAN,COTTON CREWNECK T-SHIRT,LIGHT CAMEL,CAD,620.00
3.0744573456180874e+18,2V0ABM558EM7D3,MAN,SHIRT IN CHIFFON WITH COTTON PLASTRON AND TIES AT THE WAIST,WHITE/EBONY,CAD,2080.00
3.0744573456180874e+18,2V0RDC909CTE05,MAN,TECHNICAL NYLON BERMUDA SHORTS,EBONY,CAD,1320.00
3.0744573456180884e+18,2Y0B0B63PMJU02,MAN,MINI LOCÒ TOILE ICONOGRAPHE SHOULDER BAG,FONDANTBLACK,CAD,2760.00
3.0744573456180884e+18,2Y0S0H02RWCU02,MAN,TOILE ICONOGRAPHE TOTALOOP LOW-TOP SNEAKER,FONDANTBLACK,CAD,1120.00
3.0744573456180874e+18,2V0CIN509D0MYW,MAN,SILK FAILLE JACKET WITH ALL-OVER TOILE ICONOGRAPHE PRINT,EBONY/BLACK,CAD,4980.00
3.0744573456180874e+18,2V0RBK209D0MYW,MAN,CARGO PANTS IN SILK FAILLE WITH ALL-OVER TOILE ICONOGRAPHE PRINT,EBONY/BLACK,CAD,3470.00
3.0744573456180905e+18,2Y0P0U34WWHU02,MAN,LOCÒ TOILE ICONOGRAPHE CROSSBODY MINI BAG,FONDANTBLACK,CAD,1450.00
3.0744573456180884e+18,2Y0HGA30DKLMVP,MAN,TOILE ICONOGRAPHE BUCKET HAT,EBONY/BLACK,CAD,820.00
3.0744573456180874e+18,2V0MG14W9DFE05,MAN,COTTON CREWNECK T-SHIRT,EBONY,CAD,620.00
3.0744573456180884e+18,2Y0S0G80SBT6ZN,MAN,VLOGO TOILE ICONOGRAPHE SANDAL,BEIGE/BLACK,CAD,1240.00
3.0744573456180884e+18,2Y0HDA10STBMVP,MAN,TOILE ICONOGRAPHE BASEBALL CAP,EBONY/BLACK,CAD,820.00
3.0744573456180884e+18,2Y0S0H01RWC6ZN,MAN,TOILE ICONOGRAPHE TOTALOOP HIGH-TOP SNEAKER,BEIGE/BLACK,CAD,1240.00
3.0744573456180905e+18,2Y0T0SB3BQBU02,MAN,TOILE ICONOGRAPHE BELT WITH LEATHER DETAILING,FONDANTBLACK,CAD,840.00
3.0744573456180884e+18,2Y0B0C10XLU0NO,MAN,LE TROISIEME RUBBER SHOPPING BAG,black,CAD,2080.00
3.0744573456180864e+18,2V0ABM109DJE05,MAN,STRETCH-CHIFFON CREWNECK TOP,EBONY,CAD,2080.00
,2V0CEE319DPE05,MAN,PLEATED TECHNICAL NYLON DOUBLE-BREASTED JACKET,,CAD,5150.00
3.0744573456180884e+18,2Y0B0C07JXDU02,MAN,LE TROISIEME TOILE ICONOGRAPHE LARGE SHOPPER,FONDANTBLACK,CAD,3720.00
,2V0RBK108EJE05,MAN,WOOL PANTS WITH BELT AND SATIN SIDE BANDS,,CAD,1700.00
,2V0CE3658EJE05,MAN,WOOL DINNER JACKET WITH MAISON VALENTINO TAILORING LABEL AND CHIFFON INNER BIB,,CAD,3970.00
3.0744573456180884e+18,2W0S0R01EBHJ4A,GIFTS FOR HER,VLOGO SIGNATURE SLINGBACK PUMP IN TOILE ICONOGRAPHE 80MM,BEIGE/RED,CAD,1240.00
3.074457345618083e+18,2W0B0L97JSQJ4A,GIFTS FOR HER,SMALL LOCÒ TOILE ICONOGRAPHE SHOULDER BAG,BEIGE/RED,CAD,3090.00
3.0744573456180756e+18,2W2HGA65IEKEX9,GIFTS FOR HER,TOILE ICONOGRAPHE BUCKET HAT,BEIGE/BLACK,CAD,910.00
3.0744573456180767e+18,2W2T0SD5WMC6ZN,GIFTS FOR HER,TOILE ICONOGRAPHE BELT H.40 MM,BEIGE/BLACK,CAD,840.00
3.0744573456180874e+18,2W0P0Z11VRIJ4A,GIFTS FOR HER,LOCÒ TOILE ICONOGRAPHE PHONE CASE WITH CHAIN,BEIGE/RED,CAD,1450.00
3.0744573456180874e+18,2W0P0Z10VRI6ZN,GIFTS FOR HER,TOILE ICONOGRAPHE LOCÒ TRIFOLD WALLET WITH CHAIN,BEIGE/BLACK,CAD,1120.00
3.0744573456176005e+18,2W2J0G04YCWMH5,GIFTS FOR HER,VLogo Signature earrings in metal and Swarovski® crystals.,GOLD/CRYSTAL SILVER,CAD,910.00
3.0744573456180756e+18,2W2E6017QDNV3C,GIFTS FOR HER,TOILE ICONOGRAPHE SILK BANDEAU SCARF,BEIGE/RED,CAD,340.00
3.0744573456180874e+18,2W0S0GX4RWC6ZN,GIFTS FOR HER,TOILE ICONOGRAPHE TOTALOOP LOW-TOP SNEAKER,BEIGE/BLACK,CAD,1120.00
3.0744573456177137e+18,ZW2P0V32SNP0NO,GIFTS FOR HER,VLOGO SIGNATURE GRAINY CALFSKIN CARDHOLDER,black,CAD,400.00
3.074457345618029e+18,1W2P0R39SNP0NO,GIFTS FOR HER,COMPACT VLOGO SIGNATURE GRAINY CALFSKIN WALLET,black,CAD,720.00
3.0744573456176e+18,1W2J0G74YCWMH5,GIFTS FOR HER,VLogo Signature Metal and Crystal Ring,gold,CAD,720.00
3.0744573456180357e+18,1W2J0E82YCWMH5,GIFTS FOR HER,VLOGO SIGNATURE METAL BROOCH WITH SWAROVSKI® CRYSTALS,gold,CAD,620.00
3.0744573456180874e+18,2W0S0GS4WIC6ZN,GIFTS FOR HER,TOILE ICONOGRAPHE SLIDE SANDAL,BEIGE/BLACK,CAD,970.00
3.074457345617622e+18,ZW2P0T35BOL0NO,GIFTS FOR HER,ROCKSTUD CALFSKIN CARDHOLDER WITH ZIPPER,black,CAD,470.00
3.074457345618038e+18,2W2T0S11ACNV2U,GIFTS FOR HER,VLOGO SIGNATURE REVERSIBLE SHINY CALFSKIN BELT 40MM,light ivory/black,CAD,1320.00
3.0744573456179937e+18,XW2S0DQ3VNE0NO,GIFTS FOR HER,VALENTINO GARAVANI TAN-GO PLATFORM PUMP IN PATENT LEATHER 155 MM,black,CAD,1510.00
3.074457345618025e+18,Z80LD497600000,GIFTS FOR HER,BORN IN ROMA CORAL FANTASY EAU DE PARFUM SPRAY 100ML,transparent,CAD,170.00
3.0744573456180874e+18,2W0S0GX4RWCJ4A,GIFTS FOR HER,TOILE ICONOGRAPHE TOTALOOP LOW-TOP SNEAKER,BEIGE/RED,CAD,1120.00
3.074457345617692e+18,Z80LC334600000,GIFTS FOR HER,BORN IN ROMA YELLOW DREAM FOR HER EAU DE PARFUM SPRAY 100 ML,transparent,CAD,172.00
3.0744573456180874e+18,2W0B0L90HUJJ4A,GIFTS FOR HER,LE TROISIÈME MINI SHOPPING BAG IN TOILE ICONOGRAPHE,BEIGE/RED,CAD,2650.00
3.0744573456180874e+18,2W0S0GS4WICJ4A,GIFTS FOR HER,TOILE ICONOGRAPHE SLIDE SANDAL,BEIGE/RED,CAD,970.00
3.0744573456180756e+18,2W2EI114WYTV3D,GIFTS FOR HER,TOILE ICONOGRAPHE SILK SCARF 90X90,BEIGE/BLACK,CAD,740.00
3.074457345618026e+18,XW0T0S12ZFRC34,GIFTS FOR HER,REVERSIBLE VLOGO SIGNATURE BELT IN Shiny CALFSKIN 20MM,LIGHT IVORY/ROSE CANNELLE,CAD,660.00
3.0744573456177423e+18,1W0J0P21METCS4,GIFTS FOR HER,VLOGO SIGNATURE METAL EARCUFF,gold,CAD,190.00
3.0744573456180756e+18,2W2B0L29HUJJ4A,GIFTS FOR HER,LA TROISIEME TOILE ICONOGRAPHE SHOPPING BAG,BEIGE/RED,CAD,3390.00
3.0744573456180874e+18,2W0P0Z10VRIJ4A,GIFTS FOR HER,TOILE ICONOGRAPHE LOCÒ TRIFOLD WALLET WITH CHAIN,BEIGE/RED,CAD,1120.00
3.074457345617636e+18,2W2J0H29YCWMH5,GIFTS FOR HER,VLOGO SIGNATURE EARRINGS IN METAL AND SWAROVSKI® CRYSTALS,GOLD/CRYSTAL SILVER,CAD,370.00
3.0744573456180285e+18,2W2P0T83HPF0NO,GIFTS FOR HER,MINI BUCKET BAG IN NAPPA WITH VLOGO SIGNATURE CHAIN,black,CAD,1630.00
3.0744573456180767e+18,2W2S0L42ECGND3,GIFTS FOR HER,VLOGO SIGNATURE TRANSPARENT POLYMER SLIDE SANDAL,SADDLE BROWN/TRANSPARENT,CAD,1000.00
3.0744573456180874e+18,2W0P0Z11ZXL0NO,GIFTS FOR HER,LOCÒ CALFSKIN PHONE CASE WITH CHAIN,black,CAD,1510.00
3.0744573456176353e+18,2W2J0F84METCS4,GIFTS FOR HER,VLogo Signature Metal Bracelet,gold,CAD,470.00
3.0744573456180756e+18,2W2HGA65IEKJ4A,GIFTS FOR HER,TOILE ICONOGRAPHE BUCKET HAT,BEIGE/RED,CAD,910.00
3.0744573456180756e+18,2W2P0Y74HUJJ4A,GIFTS FOR HER,TOILE ICONOGRAPHE ZIPPER CARDHOLDER,BEIGE/RED,CAD,660.00
3.0744573456180767e+18,2W2T0SD5WMCJ4A,GIFTS FOR HER,TOILE ICONOGRAPHE BELT H.40 MM,BEIGE/RED,CAD,840.00
3.074457345617494e+18,ZW2J0F96METCS4,GIFTS FOR HER,VLogo Signature Metal Earrings,gold,CAD,530.00
3.0744573456180874e+18,2W0J0F42LWVK4D,GIFTS FOR HER,VLOGO SIGNATURE LEATHER BRACELET,fondant,CAD,490.00
3.0744573456180296e+18,1W2P0W19RQR0NO,GIFTS FOR HER,MINI VLOGO SIGNATURE GRAINY CALFSKIN HOBO BAG,black,CAD,1630.00
3.0744573456175846e+18,ZW2P0T35BOLP45,GIFTS FOR HER,ROCKSTUD CALFSKIN CARDHOLDER WITH ZIPPER,poudre,CAD,470.00
3.074457345618038e+18,2W2T0S11GEPV2X,GIFTS FOR HER,VLOGO SIGNATURE REVERSIBLE SHINY CALFSKIN BELT 40MM,ROSE CANNELLE/BLACK,CAD,1630.00
3.074457345618084e+18,2W0S0C47NGUV6L,GIFTS FOR HER,ROCKSTUD SLIDER SANDAL IN POLYMER MATERIAL WITH PLEXI HEEL 60MM,PINK/TRANSPARENT,CAD,1450.00
3.0744573456180756e+18,2W2P0Y47BSFGF9,GIFTS FOR HER,ROMAN STUD WALLET IN NAPPA LEATHER WITH CHAIN,rose cannelle,CAD,1880.00
3.074457345618023e+18,2W2J0P13UXM0O3,GIFTS FOR HER,VLOGO SIGNATURE METAL NECKLACE WITH SWAROVSKI® PEARLS,gold,CAD,950.00
3.0744573456175846e+18,ZW2T0S11ZFRLC8,GIFTS FOR HER,REVERSIBLE VLOGO SIGNATURE BELT IN Shiny CALFSKIN 40MM,SMOKEY BEIGE/BLACK,CAD,820.00
3.074457345617494e+18,ZW2J0G35METCS4,GIFTS FOR HER,Rockstud Metal Earrings,gold,CAD,470.00
3.0744573456176353e+18,2W2J0G76METCS4,GIFTS FOR HER,VLogo Signature Metal Earrings,gold,CAD,400.00
3.0744573456180767e+18,2W2S0GJ4ILAV6L,GIFTS FOR HER,ROCKSTUD KIDSKIN SANDAL 100MM,rose cannelle,CAD,1510.00
3.0744573456180874e+18,2W0P0Z11ZXLGF9,GIFTS FOR HER,LOCÒ CALFSKIN PHONE CASE WITH CHAIN,rose cannelle,CAD,1510.00
3.0744573456180547e+18,2Y2J0M96DTK0NO,GIFTS FOR HIM,VLOGO SIGNATURE COTTON BRACELET,black,CAD,240.00
3.0744573456179835e+18,2Y2P0S49ZQU0NO,GIFTS FOR HIM,VLogo Signature Cardholder,black,CAD,440.00
3.074457345618025e+18,Z80LD498500000,GIFTS FOR HIM,BORN IN ROMA CORAL FANTASY EAU DE TOILETTE SPRAY 100ML,transparent,CAD,125.00
3.0744573456180767e+18,2Y2J0Q15GTQ0NO,GIFTS FOR HIM,VLOGO SIGNATURE LEATHER BRACELET,black,CAD,470.00
3.0744573456180767e+18,2Y2P0P09VTQ0NO,GIFTS FOR HIM,VLOGO SIGNATURE CALFSKIN POUCH,black,CAD,1450.00
3.074457345617766e+18,2Y2P0713ZQU0NO,GIFTS FOR HIM,VLogo Signature Cardholder,black,CAD,570.00
3.074457345618075e+18,2V3KC24M9550NO,GIFTS FOR HIM,CASHMERE CREWNECK SWEATER WITH BLACK UNTITLED STUDS,black,CAD,2210.00
3.074457345618069e+18,1Y0S0G37XTM0BO,GIFTS FOR HIM,ONE STUD XL NAPPA LEATHER LOW-TOP SNEAKER,white,CAD,1250.00
3.074457345617692e+18,Z80LC334800000,GIFTS FOR HIM,BORN IN ROMA YELLOW DREAM FOR HIM EAU DE TOILETTE SPRAY 100 ML,transparent,CAD,126.00
3.0744573456180767e+18,2Y2J0P47UXMV1Y,GIFTS FOR HIM,VLOGO SIGNATURE METAL CHOKER WITH SWAROVSKI® PEARLS,ruthenium,CAD,950.00
3.074457345617087e+18,2Y2T0Q87SNP0NO,GIFTS FOR HIM,VLOGO SIGNATURE CALFSKIN BELT 40 MM,black,CAD,720.00
3.0744573456180767e+18,2Y2P0U31ZQU0NO,GIFTS FOR HIM,MINI VLOGO SIGNATURE CALFSKIN CARDHOLDER,black,CAD,590.00
3.0744573456180767e+18,2Y2S0G77VPZA01,GIFTS FOR HIM,VLTN FABRIC SLIP-ON SNEAKER,white/ black,CAD,970.00
3.074457345617979e+18,2Y2T0Q87AZR0NO,GIFTS FOR HIM,VLOGO SIGNATURE CALFSKIN BELT 40 MM,black,CAD,720.00
3.0744573456180767e+18,2Y2T0T47MRX00B,GIFTS FOR HIM,VLOGO SIGNATURE REVERSIBLE ELK-PRINT CALFSKIN BELT 30 MM,BLACK/RUBY,CAD,840.00
3.0744573456180767e+18,2Y2S0G51TUFUZ5,GIFTS FOR HIM,STUD AROUND LOW-TOP CALFSKIN AND NAPPA LEATHER SNEAKER,WHITE/CHOCOLATE BROWN,CAD,1070.00
3.074457345618075e+18,2V3KC24U95NUZC,GIFTS FOR HIM,WOOL AND CASHMERE CREWNECK SWEATER WITH VLOGO SIGNATURE EMBROIDERY,MAROON/IVORY/WISTERIA,CAD,1700.00
3.0744573456180756e+18,2V3RBJ418YELZ8,GIFTS FOR HIM,COTTON GABARDINE PANTS,sand,CAD,1370.00
3.0744573456180767e+18,2Y2S0G51TUFQ1X,GIFTS FOR HIM,STUD AROUND LOW-TOP CALFSKIN AND NAPPA LEATHER SNEAKER,white/ black,CAD,1070.00
3.0744573456180767e+18,2Y2T0T46XURM77,GIFTS FOR HIM,VLOGO SIGNATURE REVERSIBLE BELT IN ELK PRINT CALFSKIN 40MM,black/marine,CAD,870.00
3.0744573456180767e+18,2Y2S0G77VPZ0NI,GIFTS FOR HIM,VLTN FABRIC SLIP-ON SNEAKER,black/white,CAD,970.00
3.074457345618038e+18,2Y2P0T85LVN0NI,GIFTS FOR HIM,VLTN WASHBAG,black/white,CAD,1120.00
3.0744573456180756e+18,2V3MG13D96STTL,GIFTS FOR HIM,COTTON CREWNECK T-SHIRT WITH VLTN PRINT,BLACK/WHITE/RED,CAD,690.00
3.0744573456180767e+18,2Y2HGA32UZF0NO,GIFTS FOR HIM,BLACK UNTITLED BUCKET HAT,black,CAD,870.00
3.074457345618069e+18,1Y0S0G37XTMUWT,GIFTS FOR HIM,ONE STUD XL NAPPA LEATHER LOW-TOP SNEAKER,PINK PP,CAD,1250.00
3.0744573456180767e+18,2Y2B0993FRXUWT,GIFTS FOR HIM,VLTN NYLON BACKPACK,PINK PP,CAD,2080.00
3.0744573456180767e+18,2Y2S0F57KJU74D,GIFTS FOR HIM,MS-2960 LOW-TOP SNEAKER IN FABRIC AND CALFSKIN,BLACK/GRAPHITE/WHITE,CAD,1450.00
3.0744573456180767e+18,2Y2J0M96DTK298,GIFTS FOR HIM,VLOGO SIGNATURE COTTON BRACELET,BLUE,CAD,240.00
3.074457345618075e+18,2V3KC24U95NV1W,GIFTS FOR HIM,WOOL AND CASHMERE CREWNECK SWEATER WITH VLOGO SIGNATURE EMBROIDERY,BLACK/IVORY/MINT,CAD,1700.00
3.074457345618075e+18,2V3DE01T93P0NO,GIFTS FOR HIM,DENIM PANTS WITH BLACK UNTITLED STUDS,black,CAD,1580.00
3.0744573456180767e+18,2Y2B0B94FRXUWT,GIFTS FOR HIM,VLTN NYLON BELT BAG,PINK PP,CAD,1450.00
3.074457345618069e+18,1Y0S0G37XTM0NO,GIFTS FOR HIM,ONE STUD XL NAPPA LEATHER LOW-TOP SNEAKER,black,CAD,1250.00
3.074457345617979e+18,2Y2T0Q90AZR0NO,GIFTS FOR HIM,VLOGO SIGNATURE CALFSKIN BELT 30 MM,black,CAD,660.00
3.0744573456180767e+18,2Y2S0F57QHR74B,GIFTS FOR HIM,MS-2960 LOW-TOP SNEAKER IN FABRIC AND CALFSKIN,WHITE/SILVER/PASTEL GRAY,CAD,1450.00
3.0744573456180756e+18,2V3MF15P96QUWT,GIFTS FOR HIM,COTTON HOODED SWEATSHIRT WITH VLTN PRINT,PINK PP,CAD,1200.00
3.0744573456180874e+18,2W0B0K53IYSJU5,Locò,LOCÒ CALFSKIN SHOULDER BAG,rouge pur,CAD,3210.00
3.0744573456180874e+18,2W0B0K53LPS0NO,Locò,LOCÒ SMALL SHOULDER BAG IN CALFSKIN,black,CAD,3400.00
,2W0B0K53IHSK4Q,Locò,SMALL LOCÒ SHOULDER BAG WITH TOILE ICONOGRAPHE EMBROIDERY,,CAD,5670.00
3.0744573456180874e+18,2W0P0Z06WXWK4Q,Locò,LOCÒ MICRO BAG WITH CHAIN WITH TOILE ICONOGRAPHE EMBROIDERY,RED/SILVER,CAD,2130.00
3.0744573456180874e+18,2W0B0K53MKKUV4,Locò,SMALL LOCÒ SHOULDER BAG WITH CRYSTALS,silver,CAD,6170.00
3.0744573456180874e+18,2W0B0K53KUHMZR,Locò,SMALL LOCÒ SHOULDER BAG WITH 3D EMBROIDERY,PRECIOUS GREEN,CAD,5290.00
3.0744573456180874e+18,2W0B0K53YAPMUV,Locò,SMALL LOCÒ SHOULDER BAG WITH 3D EMBROIDERY,pink,CAD,5670.00
3.0744573456180874e+18,2W0B0K53QLPMVL,Locò,LOCÒ SMALL SHOULDER BAG WITH FLORAL MOTIF EMBROIDERY,silver,CAD,5670.00
3.0744573456180357e+18,2W2B0K53KNT7P1,Locò,LOCÒ SMALL SHOULDER BAG WITH JEWEL LOGO,rose cannelle,CAD,3970.00
3.0744573456180357e+18,2W2B0K53KNT7NX,Locò,LOCÒ SMALL SHOULDER BAG WITH JEWEL LOGO,light ivory,CAD,3970.00
3.0744573456180756e+18,2W2B0K53FSZK3W,Locò,LOCÒ SMALL SHOULDER BAG WITH JEWEL LOGO,morning dew,CAD,3970.00
3.0744573456180756e+18,2W2B0K53FSZK3X,Locò,LOCÒ SMALL SHOULDER BAG WITH JEWEL LOGO,CANDY ROSE,CAD,3970.00
3.074457345618029e+18,1W2B0K30ZXL0NO,Locò,LOCÒ CALFSKIN SHOULDER BAG,black,CAD,3400.00
3.074457345618029e+18,1W2B0K30ZXLI16,Locò,LOCÒ CALFSKIN SHOULDER BAG,light ivory,CAD,3400.00
3.0744573456179917e+18,XW2B0K30ZXLKN8,Locò,VLOGO SIGNATURE CALFSKIN SHOULDER BAG,yellow,CAD,3400.00
3.0744573456180756e+18,2W2B0K30JCNND3,Locò,LOCÒ SHOULDER BAG MADE IN POLYMERIC MATERIAL,TRANSPARENT/SADDLE BROWN,CAD,3260.00
3.0744573456180756e+18,2W2B0K30JCNYL0,Locò,LOCÒ SHOULDER BAG MADE IN POLYMERIC MATERIAL,TRANSPARENT/OPTICAL WHITE,CAD,3260.00
3.0744573456180357e+18,1W2B0K53ZXL0NO,Locò,LOCÒ SMALL SHOULDER BAG IN CALFSKIN,black,CAD,3090.00
3.0744573456180357e+18,1W2B0K53ZXLI16,Locò,LOCÒ SMALL SHOULDER BAG IN CALFSKIN,light ivory,CAD,3090.00
3.0744573456180756e+18,2W2B0K53ZXL699,Locò,LOCÒ SMALL SHOULDER BAG IN CALFSKIN,WISTERIA,CAD,3090.00
3.0744573456180357e+18,1W2B0K53ZXL7PA,Locò,LOCÒ SMALL SHOULDER BAG IN CALFSKIN,green,CAD,3090.00
3.0744573456180357e+18,1W2B0K53ZXLM24,Locò,LOCÒ SMALL SHOULDER BAG IN CALFSKIN,ROSE VIOLET,CAD,3090.00
3.0744573456180357e+18,1W2B0K53ZXLQ34,Locò,LOCÒ SMALL SHOULDER BAG IN CALFSKIN,ULTRAMARINE,CAD,3090.00
3.0744573456180756e+18,2W2B0K53TSKNDZ,Locò,LOCÒ EMBROIDERED SMALL SHOULDER BAG,GOLD CRYSTAL/ANTIQUE BRASS,CAD,5670.00
3.0744573456180357e+18,1W2B0K53SLXV4D,Locò,LOCÒ EMBROIDERED SMALL SHOULDER BAG,MAGENTA/CRYSTAL,CAD,5540.00
3.0744573456180357e+18,2W2B0K53JTTV3W,Locò,LOCÒ EMBROIDERED SMALL SHOULDER BAG,SILVER/CRYSTAL,CAD,5540.00
3.0744573456180756e+18,2W2B0K53UKER16,Locò,SMALL LOCÒ METALLIC CALFSKIN SHOULDER BAG,platinum,CAD,3260.00
3.0744573456180756e+18,2W2P0Y41UKER16,Locò,MICRO BAG WITH LOCÒ CHAIN IN METALLIC CALFSKIN,platinum,CAD,1390.00
3.0744573456180756e+18,2W2B0K53LCLNBF,Locò,SMALL LOCÒ SHOULDER BAG WITH 3D EMBROIDERY,GOLD/MULTICOLOR,CAD,5290.00
3.0744573456180756e+18,2W2B0K53BYYYU4,Locò,SMALL LOCÒ SHOULDER BAG WITH 3D EMBROIDERY,ASTRAL PURPLE,CAD,5170.00
3.0744573456180756e+18,2W2B0K53BYYNB6,Locò,SMALL LOCÒ SHOULDER BAG WITH 3D EMBROIDERY,ANTIQUE GREEN,CAD,5170.00
3.074457345618028e+18,2W2B0I82BSF0NO,Roman Stud,Medium Roman Stud The Shoulder Bag in Nappa with Chain,black,CAD,4470.00
3.0744573456177423e+18,2W2B0I82LWB0NO,Roman Stud,MEDIUM ROMAN STUD THE SHOULDER BAG IN NAPPA WITH CHAIN AND TONE-ON-TONE STUDS,black,CAD,4790.00
3.0744573456180756e+18,2W2B0I82XRY7AN,Roman Stud,MEDIUM ROMAN STUD THE SHOULDER BAG IN RAFFIA WITH CHAIN AND RHINESTONES,NATURAL/CRYSTAL,CAD,5990.00
3.0744573456180756e+18,2W2B0L81GSZO39,Roman Stud,ROMAN STUD RAFFIA BUCKET BAG,natural,CAD,3590.00
3.074457345618023e+18,XW0B0I82HMRF23,Roman Stud,MEDIUM ROMAN STUD THE SHOULDER BAG IN DENIM WITH CHAIN,DENIM,CAD,4470.00
3.0744573456180756e+18,2W2B0I82SEA76T,Roman Stud,MEDIUM BAG WITH ROMAN STUD CHAIN IN POLYMER MATERIAL,TRANSPARENT/ROSE QUARTZ,CAD,4600.00
3.0744573456179907e+18,XW2B0I82PTH16Q,Roman Stud,MEDIUM ROMAN STUD THE SHOULDER BAG IN NAPPA WITH CHAIN AND ENAMELED STUDS,rose quartz,CAD,4780.00
